<?xml version="1.0" encoding="ISO-8859-1" ?>

<workflows xmlns='http://www.1ci.de'
  xmlns:xsi='http://www.w3.org/2001/XMLSchema-instance'
  xsi:schemaLocation='http://www.1ci.de ../../../etc/WORKFLOWS.xsd'
  version="2.0"
>

    <workflow id="register">
    
        <page id="registerpage1" template="form_register_p1.jsp" formid="form1" editable="true">
            <formmap table="vkunde" primarykey="kundennr">
                <fieldmap formfield="name" dbfield="name"/>
                <fieldmap formfield="vorname" dbfield="vorname"/>
                <fieldmap formfield="email" dbfield="email"/>
            </formmap>
            <transition name="nextpage" target="registerpage2">
            	<condition type="buttonpressed" value="Ok"/>
            </transition>
            <transition name="abort" target="list" validation="false">
            	<condition type="buttonpressed" value="Cancel"/>
            </transition>
        </page>
        
        <page id="registerpage2" template="form_register_p2.jsp" formid="form1" editable="true">
            <formmap table="vkunde" primarykey="kundennr">
                <fieldmap formfield="plz" dbfield="plz"/>
                <fieldmap formfield="strasse" dbfield="strasse"/>
                <fieldmap formfield="ort" dbfield="ort"/>
            </formmap>
            <transition name="save_to_db" target="list">
            	<condition type="buttonpressed" value="Ok"/>
            	<action type="maintain">
                    <formfield pageid="registerpage1" formid="form1" name="name"/>
                    <formfield pageid="registerpage1" formid="form1" name="vorname"/>
                    <formfield pageid="registerpage1" formid="form1" name="email"/>
                    <formfield formid="form1" name="plz"/>
                    <formfield formid="form1" name="strasse"/>
                    <formfield formid="form1" name="ort"/>
				</action>
            </transition>
            <transition name="abort" target="list" validation="false">
            	<condition type="buttonpressed" value="Cancel"/>
            </transition>
        </page>
        
        <page id="list" template="list.jsp"/>
        
    </workflow>

</workflows>
